{
  "activeOperation": null,
  "activeOperations": [],
  "activeProject": {
    "created_at": "2026-01-02T03:04:05.000Z",
    "description": "",
    "id": 1,
    "name": "Synthetic Alpha",
    "updated_at": "2026-01-02T03:04:07.000Z",
    "workspace_path": "<fixture-workspace>/p03/alpha"
  },
  "activeProjectId": 1,
  "attachments": [],
  "events": [],
  "executors": [],
  "feedback": [],
  "lastOperation": null,
  "mcp": {
    "authHeader": "Authorization: Bearer <token>",
    "authTokenMasked": "",
    "connectionExample": "http://127.0.0.1:43847/mcp",
    "enabled": false,
    "hasAuthToken": false,
    "host": "127.0.0.1",
    "lastError": null,
    "lastEvent": null,
    "localOnly": true,
    "note": "默认仅监听本机地址，供本机 MCP 客户端连接。",
    "path": "/mcp",
    "port": 43847,
    "running": false,
    "startedAt": null,
    "status": "disabled",
    "toolDocs": [
      {
        "description": "List projects with runtime state summaries.",
        "markdown": "## list_projects\n**功能**：List projects with runtime state summaries.\n**参数**\n\n| 参数 | 类型 | 必填 | 说明 |\n| --- | --- | --- | --- |\n| `query` | `string` | 否 | 最长 200 |\n| `limit` | `integer` | 否 | 最小 1；最大 200 |",
        "name": "list_projects",
        "title": "List AutoPlan projects"
      },
      {
        "description": "Get one project and its snapshot summary.",
        "markdown": "## get_project\n**功能**：Get one project and its snapshot summary.\n**参数**\n\n| 参数 | 类型 | 必填 | 说明 |\n| --- | --- | --- | --- |\n| `projectId` | `integer` | 是 | 最小 1 |",
        "name": "get_project",
        "title": "Get AutoPlan project"
      },
      {
        "description": "Create a project and return its id plus a snapshot summary.",
        "markdown": "## create_project\n**功能**：Create a project and return its id plus a snapshot summary.\n**参数**\n\n| 参数 | 类型 | 必填 | 说明 |\n| --- | --- | --- | --- |\n| `name` | `string` | 是 | 最短 1；最长 120 |\n| `workspacePath` | `string` | 是 | 最短 1；最长 1000 |\n| `description` | `string` | 否 | 最长 5000 |\n| `agentCliProvider` | `string` | 否 | Legacy external CLI provider. Project-level input maps to generation and execution defaults when new fields are omitted; intake-level input maps to plan generation only.；可选：`codex`, `claude`, `opencode`, `oh-my-pi` |\n| `agentCliCommand` | `string` | 否 | Legacy external CLI command override.；最长 1000 |\n| `codexReasoningEffort` | `string` | 否 | Legacy Codex reasoning effort. Only applies when the effective provider is codex.；可选：`low`, `medium`, `high`, `xhigh` |\n| `planGenerationStrategy` | `string` | 否 | Plan generation strategy: legacy external Markdown, external structured PlanSpec, or builtin LLM structured PlanSpec.；可选：`external-cli-markdown`, `external-cli-structured`, `builtin-llm-structured` |\n| `planGenerationProvider` | `string` | 否 | Provider for plan generation. External strategies use CLI providers; builtin LLM uses AI providers.；可选：`codex`, `claude`, `opencode`, `oh-my-pi`, `openai`, `deepseek`, `anthropic` |\n| `planGenerationCommand` | `string` | 否 | Command for external CLI plan generation strategies.；最长 1000 |\n| `planGenerationModel` | `string` | 否 | Model name for builtin LLM plan generation.；最长 200 |\n| `planGenerationCodexReasoningEffort` | `string` | 否 | Codex reasoning effort for plan generation when the effective provider is codex.；可选：`low`, `medium`, `high`, `xhigh` |\n| `planExecutionStrategy` | `string` | 否 | Plan execution strategy. external-cli is supported; builtin-llm is accepted but task execution currently returns a clear unsupported error.；可选：`external-cli`, `builtin-llm` |\n| `planExecutionProvider` | `string` | 否 | Provider for plan execution. external-cli uses CLI providers.；可选：`codex`, `claude`, `opencode`, `oh-my-pi`, `openai`, `deepseek`, `anthropic` |\n| `planExecutionCommand` | `string` | 否 | Command for external CLI plan execution.；最长 1000 |\n| `planExecutionModel` | `string` | 否 | Reserved model name for builtin LLM plan execution.；最长 200 |\n| `planExecutionCodexReasoningEffort` | `string` | 否 | Codex reasoning effort for plan execution when the effective provider is codex.；可选：`low`, `medium`, `high`, `xhigh` |",
        "name": "create_project",
        "title": "Create AutoPlan project"
      },
      {
        "description": "List requirements for a project.",
        "markdown": "## list_requirements\n**功能**：List requirements for a project.\n**参数**\n\n| 参数 | 类型 | 必填 | 说明 |\n| --- | --- | --- | --- |\n| `projectId` | `integer` | 是 | 最小 1 |\n| `status` | `string` | 否 | 可选：`open`, `completed`, `closed` |\n| `limit` | `integer` | 否 | 最小 1；最大 200 |",
        "name": "list_requirements",
        "title": "List AutoPlan requirements"
      },
      {
        "description": "Create a requirement, optionally save attachments and start the project loop. Duplicate non-closed requirements with the same normalized title and body in the project are rejected with code DUPLICATE_INTAKE and existingRequirementId.",
        "markdown": "## create_requirement\n**功能**：Create a requirement, optionally save attachments and start the project loop. Duplicate non-closed requirements with the same normalized title and body in the project are rejected with code DUPLICATE_INTAKE and existingRequirementId.\n**重复提交**：同项目内 normalized title/body 相同且未 closed 的需求会被拒绝，错误返回 `code=DUPLICATE_INTAKE` 和 `existingRequirementId`。\n**参数**\n\n| 参数 | 类型 | 必填 | 说明 |\n| --- | --- | --- | --- |\n| `projectId` | `integer` | 是 | 最小 1 |\n| `title` | `string` | 是 | 最短 1；最长 200 |\n| `body` | `string` | 是 | 最短 1；最长 100000 |\n| `attachments` | `array<object>` | 否 | 最多 20 项 |\n| `  name` | `string` | 否 | 最短 1；最长 255 |\n| `  size` | `integer` | 否 | 最小 0 |\n| `  source` | `string` | 否 | 可选：`path`, `clipboard-image` |\n| `  path` | `string` | 否 | 最短 1；最长 2000 |\n| `  type` | `string` | 否 | MIME type；最短 1；最长 200 |\n| `  dataUrl` | `string` | 否 | 最短 1；最长 10485760 |\n| `  base64` | `string` | 否 | 最短 1；最长 10485760 |\n| `  dataBase64` | `string` | 否 | 最短 1；最长 10485760 |\n| `  bytes` | `array<integer>` | 否 | 最多 10485760 项 |\n| `autoRun` | `boolean` | 否 | - |\n| `status` | `string` | 否 | 可选：`open`, `completed`, `closed` |\n| `agentCliProvider` | `string` | 否 | Legacy external CLI provider. Project-level input maps to generation and execution defaults when new fields are omitted; intake-level input maps to plan generation only.；可选：`codex`, `claude`, `opencode`, `oh-my-pi` |\n| `agentCliCommand` | `string` | 否 | Legacy external CLI command override.；最长 1000 |\n| `codexReasoningEffort` | `string` | 否 | Legacy Codex reasoning effort. Only applies when the effective provider is codex.；可选：`low`, `medium`, `high`, `xhigh` |\n| `planGenerationStrategy` | `string` | 否 | Plan generation strategy: legacy external Markdown, external structured PlanSpec, or builtin LLM structured PlanSpec.；可选：`external-cli-markdown`, `external-cli-structured`, `builtin-llm-structured` |\n| `planGenerationProvider` | `string` | 否 | Provider for plan generation. External strategies use CLI providers; builtin LLM uses AI providers.；可选：`codex`, `claude`, `opencode`, `oh-my-pi`, `openai`, `deepseek`, `anthropic` |\n| `planGenerationCommand` | `string` | 否 | Command for external CLI plan generation strategies.；最长 1000 |\n| `planGenerationModel` | `string` | 否 | Model name for builtin LLM plan generation.；最长 200 |\n| `planGenerationCodexReasoningEffort` | `string` | 否 | Codex reasoning effort for plan generation when the effective provider is codex.；可选：`low`, `medium`, `high`, `xhigh` |",
        "name": "create_requirement",
        "title": "Create AutoPlan requirement"
      },
      {
        "description": "List feedback for a project.",
        "markdown": "## list_feedback\n**功能**：List feedback for a project.\n**参数**\n\n| 参数 | 类型 | 必填 | 说明 |\n| --- | --- | --- | --- |\n| `projectId` | `integer` | 是 | 最小 1 |\n| `status` | `string` | 否 | 可选：`open`, `completed`, `closed` |\n| `limit` | `integer` | 否 | 最小 1；最大 200 |",
        "name": "list_feedback",
        "title": "List AutoPlan feedback"
      },
      {
        "description": "Create feedback, optionally associate it with a requirement and start the project loop. Duplicate non-closed feedback with the same normalized title and body in the same project and requirement association is rejected with code DUPLICATE_INTAKE and existingFeedbackId.",